{
  "auditId": "audit2:aaaaaaaaaaaaaaaaaaaaaaaaaaaaaaaa",
  "families": [
    {
      "auditedAt": "2026-09-30T00:00:00Z",
      "auditor": "fixture-auditor",
      "defects": [],
      "familyId": "expression2:00000000-0000-7000-8000-000000000001",
      "gates": {
        "canonicalLinks": "passed",
        "conversation": "passed",
        "difficulty": "passed",
        "familyInclusion": "passed",
        "formsReadings": "passed",
        "fullCard": "passed",
        "librarySummary": "passed",
        "meaningIntention": "passed",
        "mergeSplit": "passed",
        "naturalness": "passed",
        "patternsDistinctions": "passed",
        "registerRelationship": "passed",
        "segments": "passed",
        "sourceLicenseProvenance": "passed"
      },
      "status": "passed"
    },
    {
      "auditedAt": "2026-09-30T00:00:00Z",
      "auditor": "fixture-auditor",
      "defects": [],
      "familyId": "expression2:00000000-0000-7000-8000-000000000002",
      "gates": {
        "canonicalLinks": "passed",
        "conversation": "passed",
        "difficulty": "passed",
        "familyInclusion": "passed",
        "formsReadings": "passed",
        "fullCard": "passed",
        "librarySummary": "passed",
        "meaningIntention": "passed",
        "mergeSplit": "passed",
        "naturalness": "passed",
        "patternsDistinctions": "passed",
        "registerRelationship": "passed",
        "segments": "passed",
        "sourceLicenseProvenance": "passed"
      },
      "status": "passed"
    },
    {
      "auditedAt": "2026-09-30T00:00:00Z",
      "auditor": "fixture-auditor",
      "defects": [],
      "familyId": "expression2:00000000-0000-7000-8000-000000000003",
      "gates": {
        "canonicalLinks": "passed",
        "conversation": "passed",
        "difficulty": "passed",
        "familyInclusion": "passed",
        "formsReadings": "passed",
        "fullCard": "passed",
        "librarySummary": "passed",
        "meaningIntention": "passed",
        "mergeSplit": "passed",
        "naturalness": "passed",
        "patternsDistinctions": "passed",
        "registerRelationship": "passed",
        "segments": "passed",
        "sourceLicenseProvenance": "passed"
      },
      "status": "passed"
    },
    {
      "auditedAt": "2026-09-30T00:00:00Z",
      "auditor": "fixture-auditor",
      "defects": [],
      "familyId": "expression2:00000000-0000-7000-8000-000000000004",
      "gates": {
        "canonicalLinks": "passed",
        "conversation": "passed",
        "difficulty": "passed",
        "familyInclusion": "passed",
        "formsReadings": "passed",
        "fullCard": "passed",
        "librarySummary": "passed",
        "meaningIntention": "passed",
        "mergeSplit": "passed",
        "naturalness": "passed",
        "patternsDistinctions": "passed",
        "registerRelationship": "passed",
        "segments": "passed",
        "sourceLicenseProvenance": "passed"
      },
      "status": "passed"
    },
    {
      "auditedAt": "2026-09-30T00:00:00Z",
      "auditor": "fixture-auditor",
      "defects": [],
      "familyId": "expression2:00000000-0000-7000-8000-000000000005",
      "gates": {
        "canonicalLinks": "passed",
        "conversation": "passed",
        "difficulty": "passed",
        "familyInclusion": "passed",
        "formsReadings": "passed",
        "fullCard": "passed",
        "librarySummary": "passed",
        "meaningIntention": "passed",
        "mergeSplit": "passed",
        "naturalness": "passed",
        "patternsDistinctions": "passed",
        "registerRelationship": "passed",
        "segments": "passed",
        "sourceLicenseProvenance": "passed"
      },
      "status": "passed"
    },
    {
      "auditedAt": "2026-09-30T00:00:00Z",
      "auditor": "fixture-auditor",
      "defects": [],
      "familyId": "expression2:00000000-0000-7000-8000-000000000006",
      "gates": {
        "canonicalLinks": "passed",
        "conversation": "passed",
        "difficulty": "passed",
        "familyInclusion": "passed",
        "formsReadings": "passed",
        "fullCard": "passed",
        "librarySummary": "passed",
        "meaningIntention": "passed",
        "mergeSplit": "passed",
        "naturalness": "passed",
        "patternsDistinctions": "passed",
        "registerRelationship": "passed",
        "segments": "passed",
        "sourceLicenseProvenance": "passed"
      },
      "status": "passed"
    },
    {
      "auditedAt": "2026-09-30T00:00:00Z",
      "auditor": "fixture-auditor",
      "defects": [],
      "familyId": "expression2:00000000-0000-7000-8000-000000000007",
      "gates": {
        "canonicalLinks": "passed",
        "conversation": "passed",
        "difficulty": "passed",
        "familyInclusion": "passed",
        "formsReadings": "passed",
        "fullCard": "passed",
        "librarySummary": "passed",
        "meaningIntention": "passed",
        "mergeSplit": "passed",
        "naturalness": "passed",
        "patternsDistinctions": "passed",
        "registerRelationship": "passed",
        "segments": "passed",
        "sourceLicenseProvenance": "passed"
      },
      "status": "passed"
    },
    {
      "auditedAt": "2026-09-30T00:00:00Z",
      "auditor": "fixture-auditor",
      "defects": [],
      "familyId": "expression2:00000000-0000-7000-8000-000000000008",
      "gates": {
        "canonicalLinks": "passed",
        "conversation": "passed",
        "difficulty": "passed",
        "familyInclusion": "passed",
        "formsReadings": "passed",
        "fullCard": "passed",
        "librarySummary": "passed",
        "meaningIntention": "passed",
        "mergeSplit": "passed",
        "naturalness": "passed",
        "patternsDistinctions": "passed",
        "registerRelationship": "passed",
        "segments": "passed",
        "sourceLicenseProvenance": "passed"
      },
      "status": "passed"
    },
    {
      "auditedAt": "2026-09-30T00:00:00Z",
      "auditor": "fixture-auditor",
      "defects": [],
      "familyId": "expression2:00000000-0000-7000-8000-000000000009",
      "gates": {
        "canonicalLinks": "passed",
        "conversation": "passed",
        "difficulty": "passed",
        "familyInclusion": "passed",
        "formsReadings": "passed",
        "fullCard": "passed",
        "librarySummary": "passed",
        "meaningIntention": "passed",
        "mergeSplit": "passed",
        "naturalness": "passed",
        "patternsDistinctions": "passed",
        "registerRelationship": "passed",
        "segments": "passed",
        "sourceLicenseProvenance": "passed"
      },
      "status": "passed"
    },
    {
      "auditedAt": "2026-09-30T00:00:00Z",
      "auditor": "fixture-auditor",
      "defects": [],
      "familyId": "expression2:00000000-0000-7000-8000-00000000000a",
      "gates": {
        "canonicalLinks": "passed",
        "conversation": "passed",
        "difficulty": "passed",
        "familyInclusion": "passed",
        "formsReadings": "passed",
        "fullCard": "passed",
        "librarySummary": "passed",
        "meaningIntention": "passed",
        "mergeSplit": "passed",
        "naturalness": "passed",
        "patternsDistinctions": "passed",
        "registerRelationship": "passed",
        "segments": "passed",
        "sourceLicenseProvenance": "passed"
      },
      "status": "passed"
    },
    {
      "auditedAt": "2026-09-30T00:00:00Z",
      "auditor": "fixture-auditor",
      "defects": [],
      "familyId": "expression2:00000000-0000-7000-8000-00000000000b",
      "gates": {
        "canonicalLinks": "passed",
        "conversation": "passed",
        "difficulty": "passed",
        "familyInclusion": "passed",
        "formsReadings": "passed",
        "fullCard": "passed",
        "librarySummary": "passed",
        "meaningIntention": "passed",
        "mergeSplit": "passed",
        "naturalness": "passed",
        "patternsDistinctions": "passed",
        "registerRelationship": "passed",
        "segments": "passed",
        "sourceLicenseProvenance": "passed"
      },
      "status": "passed"
    },
    {
      "auditedAt": "2026-09-30T00:00:00Z",
      "auditor": "fixture-auditor",
      "defects": [],
      "familyId": "expression2:00000000-0000-7000-8000-00000000000c",
      "gates": {
        "canonicalLinks": "passed",
        "conversation": "passed",
        "difficulty": "passed",
        "familyInclusion": "passed",
        "formsReadings": "passed",
        "fullCard": "passed",
        "librarySummary": "passed",
        "meaningIntention": "passed",
        "mergeSplit": "passed",
        "naturalness": "passed",
        "patternsDistinctions": "passed",
        "registerRelationship": "passed",
        "segments": "passed",
        "sourceLicenseProvenance": "passed"
      },
      "status": "passed"
    },
    {
      "auditedAt": "2026-09-30T00:00:00Z",
      "auditor": "fixture-auditor",
      "defects": [],
      "familyId": "expression2:00000000-0000-7000-8000-00000000000d",
      "gates": {
        "canonicalLinks": "passed",
        "conversation": "passed",
        "difficulty": "passed",
        "familyInclusion": "passed",
        "formsReadings": "passed",
        "fullCard": "passed",
        "librarySummary": "passed",
        "meaningIntention": "passed",
        "mergeSplit": "passed",
        "naturalness": "passed",
        "patternsDistinctions": "passed",
        "registerRelationship": "passed",
        "segments": "passed",
        "sourceLicenseProvenance": "passed"
      },
      "status": "passed"
    },
    {
      "auditedAt": "2026-09-30T00:00:00Z",
      "auditor": "fixture-auditor",
      "defects": [],
      "familyId": "expression2:00000000-0000-7000-8000-00000000000e",
      "gates": {
        "canonicalLinks": "passed",
        "conversation": "passed",
        "difficulty": "passed",
        "familyInclusion": "passed",
        "formsReadings": "passed",